14:15:51.334645 IP 192.168.1.15.ssh > 192.168.1.3.12826: Flags [P.], seq 3887705790:3887705998, ack 4024204319, win 843, length 208
14:15:51.334902 IP 192.168.1.3.12826 > 192.168.1.15.ssh: Flags [.], ack 208, win 16333, length 0
14:15:51.335909 IP 192.168.1.15.52207 > 192.168.1.1.domain: 42785+ PTR? 3.1.168.192.in-addr.arpa. (42)
14:15:51.394585 IP 192.168.1.1.domain > 192.168.1.15.52207: 42785 NXDomain 0/1/0 (91)
14:15:51.394999 IP 192.168.1.15.47537 > 192.168.1.1.domain: 15886+ PTR? 15.1.168.192.in-addr.arpa. (43)
14:15:51.446932 IP 192.168.1.1.domain > 192.168.1.15.47537: 15886 NXDomain 0/1/0 (92)
14:15:51.447395 IP 192.168.1.15.41646 > 192.168.1.1.domain: 48004+ PTR? 1.1.168.192.in-addr.arpa. (42)
14:15:51.490499 IP 192.168.1.1.domain > 192.168.1.15.41646: 48004 NXDomain 0/1/0 (91)
14:15:52.071055 IP6 fe80::28c1:d3ce:dfa2:e072.57278 > ff02::1:3.hostmon: UDP, length 22
14:15:52.071535 IP 192.168.1.15.60510 > 192.168.1.1.domain: 21189+ PTR? 3.0.0.0.1.0.0.0.0.0.0.0.0.0.0.0.0.0.0.0.0.0.0.0.0.0.0.0.2.0.f.f.ip6.arpa. (90)
14:15:52.071687 IP 192.168.1.3.50158 > 224.0.0.252.hostmon: UDP, length 22
14:15:52.078593 IP 192.168.1.3.bootpc > 255.255.255.255.bootps: BOOTP/DHCP, Request from b4:b5:2f:91:26:58 (oui Unknown), length 300
14:15:52.114661 IP 192.168.1.1.domain > 192.168.1.15.60510: 21189 NXDomain 0/1/0 (160)
14:15:52.115103 IP 192.168.1.15.44239 > 192.168.1.1.domain: 7209+ PTR? 2.7.0.e.2.a.f.d.e.c.3.d.1.c.8.2.0.0.0.0.0.0.0.0.0.0.0.0.0.8.e.f.ip6.arpa. (90)
14:15:52.159436 IP 192.168.1.1.domain > 192.168.1.15.44239: 7209 NXDomain 0/1/0 (160)
14:15:52.159967 IP 192.168.1.15.42042 > 192.168.1.1.domain: 5451+ PTR? 252.0.0.224.in-addr.arpa. (42)
14:15:52.172075 IP6 fe80::28c1:d3ce:dfa2:e072.57278 > ff02::1:3.hostmon: UDP, length 22
14:15:52.172118 IP 192.168.1.3.50158 > 224.0.0.252.hostmon: UDP, length 22
14:15:52.201374 IP 192.168.1.1.domain > 192.168.1.15.42042: 5451 NXDomain 0/1/0 (99)
14:15:52.201811 IP 192.168.1.15.46269 > 192.168.1.1.domain: 27292+ PTR? 255.255.255.255.in-addr.arpa. (46)
14:15:52.252800 IP 192.168.1.1.domain > 192.168.1.15.46269: 27292* 0/1/0 (81)
14:15:52.374195 IP 192.168.1.3.netbios-ns > 192.168.1.255.netbios-ns: NBT UDP PACKET(137): QUERY; REQUEST; BROADCAST
14:15:52.374631 IP 192.168.1.15.55948 > 192.168.1.1.domain: 53681+ PTR? 255.1.168.192.in-addr.arpa. (44)
14:15:52.417328 IP 192.168.1.1.domain > 192.168.1.15.55948: 53681 NXDomain* 0/1/0 (79)
14:15:52.599046 IP 192.168.1.15.ssh > 192.168.1.3.12826: Flags [P.], seq 208:592, ack 1, win 843, length 384
14:15:52.626501 IP 192.168.1.3.12826 > 192.168.1.15.ssh: Flags [P.], seq 1:65, ack 592, win 16237, length 64

